date,title,link,page
2023-03-21,Rookie Referral: Invite One Friend and Earn 25 USDT in Bonuses!,https://announcements.bybit.com/en-US/article/rookie-referral-invite-one-friend-and-earn-25-usdt-in-bonuses--bltedbdebb8169fda38/,80
2023-03-21,Delisting of USDC Perpetual Contracts,https://announcements.bybit.com/en-US/article/delisting-of-usdc-perpetual-contracts-blt078ab5dce506e11e/,80
2023-03-21,Now Live: BTC and ETH USDC-Settled Futures Contracts,https://announcements.bybit.com/en-US/article/now-live-btc-and-eth-usdc-settled-futures-contracts-blt510d764e5d57e106/,80
2023-03-21,P2P Trading: Trade ETH With All Supported Fiat Currencies,https://announcements.bybit.com/en-US/article/p2p-trading-trade-eth-with-all-supported-fiat-currencies-blt070c19f437a20a9d/,80
2023-03-21,"ACS/USDT — Trade to Share a 5,000,000 ACS Prize Pool!",https://announcements.bybit.com/en-US/article/acs-usdt-trade-to-share-a-5-000-000-acs-prize-pool--bltf03d511258774b5d/,80
2023-03-20,Bybit Quests: Learn About Modular Layer-2 Mantle and Stand to Win 25 USDT,https://announcements.bybit.com/en-US/article/bybit-quests-learn-about-modular-layer-2-mantle-and-stand-to-win-25-usdt-bltbe12dd453be0b78f/,80
2023-03-20,🔥 New Assets on Margin Trading: Trade Up to 10x With UTA,https://announcements.bybit.com/en-US/article/-new-assets-on-margin-trading-trade-up-to-10x-with-uta-blta4d646793b288d4f/,80
2023-03-18,Adjustment of USDT Lending Rates under Unified Trading Account,https://announcements.bybit.com/en-US/article/adjustment-of-usdt-lending-rates-under-uta-blt10c83a8acd098bab/,81
2023-03-17,"DCA March Mania: Earn Up to 47,599% APR With DCA Bots!",https://announcements.bybit.com/en-US/article/dca-march-mania-earn-up-to-47-599-apr-with-dca-bots--blt5f0bf284bb73fb80/,81
2023-03-17,"New Listing: Arbitrum (ARB) — Deposit, Trade and Stake ARB to Share a 400,000 USDT Prize Pool!",https://announcements.bybit.com/en-US/article/new-listing-arbitrum-arb-deposit-trade-and-stake-arb-to-share-a-400-000-usdt-prize-pool--bltf662314c211a8616/,81
2023-03-17,Delisting of SWEAT USDC Perpetual Contract,https://announcements.bybit.com/en-US/article/delisting-of-sweat-perp-perpetual-contract-blt8e274f52b3d10951/,81
2023-03-17,Lucky Charms: Buy Crypto on P2P and Get 17 USDT in Bonuses!,https://announcements.bybit.com/en-US/article/lucky-charms-buy-crypto-on-p2p-and-get-17-usdt-in-bonuses--blt1eb4445965142277/,81
2023-03-17,"Deposit Delight: Grab a Share of the 30,000 USDT Prize Pool!",https://announcements.bybit.com/en-US/article/deposit-delight-grab-a-share-of-the-30-000-usdt-prize-pool--blt905f0e4c3492d9e4/,81
2023-03-16,"99% Winning: Crypto Spinning with iPhone 14, Honda Motor and 30K USDT! (Exclusive for Vietnam and Malaysia)",https://announcements.bybit.com/en-US/article/vnmycryptospinning23-bltcb7919636a806d0e/,81
2023-03-16,Become a Bybit VIP and Enjoy Fiat Benefits!,https://announcements.bybit.com/en-US/article/become-a-bybit-vip-and-enjoy-fiat-benefits--blt41ae44fc85dbfd56/,81
2023-03-16,"New Listing: DZOO/USDT — Grab a Share of the 110,000 USDT Prize Pool!",https://announcements.bybit.com/en-US/article/new-listing-dzoo-usdt-grab-a-share-of-the-110-000-usdt-prize-pool--bltd4e27e73f0b56337/,82
2023-03-16,"Referral Royale Reloaded: Earn Cashback From 200,000 USDT Prize Pool",https://announcements.bybit.com/en-US/article/referral-royale-reloaded-earn-cashback-from-200-000-usdt-prize-pool-blt96c64c5ec9a5cf03/,82
2023-03-16,Changes to Max. Open Interest for Perpetual Contracts -3.16,https://announcements.bybit.com/en-US/article/changes-to-max-open-interest-for-perpetual-contracts--3-16-blt8599900cb9ab9216/,82
2023-03-15,Derivatives Index Price: Removal of Huobi and Gemini Spot Index Components,https://announcements.bybit.com/en-US/article/derivatives-index-price-removal-of-huobi-and-gemini-spot-index-components-bltb3b10253f63e0de8/,82
2023-03-15,Notice on Removal of BUSD Flexible Savings Product,https://announcements.bybit.com/en-US/article/notice-on-removal-of-busd-flexible-savings-product-blt9831b5a82a0c2395/,82
2023-03-15,"P2P Trading Games: Grab a Share of the 10,000 USDT Bonus Pool!",https://announcements.bybit.com/en-US/article/p2p-trading-games-grab-a-share-of-the-10-000-usdt-bonus-pool--blt6bf0799b203894af/,82
2023-03-15,Introducing Bybit Copy Trading Exclusive Slots,https://announcements.bybit.com/en-US/article/introducing-bybit-copy-trading-exclusive-slots-bltafba351d6b956111/,82
2023-03-15,USDT Perpetual: Risk Limit Adjustment for STXUSDT,https://announcements.bybit.com/en-US/article/usdt-perpetual-risk-limit-adjustment-for-stxusdt-blt74c7e514a2de672c/,82
2023-03-14,USDC Delta Contingency for UTA and UMA Under Portfolio Margin Mode,https://announcements.bybit.com/en-US/article/usdc-delta-contingency-for-uta-and-uma-under-portfolio-margin-mode-bltfb7c9c0894f4d881/,83
2023-03-14,Bybit to Support Radiant Capital (RDNT) Contract Swap (Expected on Mar 17),https://announcements.bybit.com/en-US/article/bybit-to-support-radiant-capital-rdnt-contract-swap-expected-on-mar-17--bltaba3839302125c69/,83
2023-03-14,Just Landed: 14 New Copy Trading Pairs 🔥,https://announcements.bybit.com/en-US/article/just-landed-14-new-copy-trading-pairs--blta509ad21728653a6/,83
2023-03-14,"New Listing: FB/USDT — Trade to Share a 5,000 FB Prize Pool",https://announcements.bybit.com/en-US/article/trade-to-share-a-5-000-fb-prize-pool--blt5ff5e68a5d146d09/,83
2023-03-13,App Starter Mystery Box: Win Up to 500 USDT in Rewards!,https://announcements.bybit.com/en-US/article/app-starter-mystery-box-win-up-to-500-usdt-in-rewards--bltde1b4e237602dc1e/,83
2023-03-13,Helium Network Migration: Suspension of HNT Deposits and Withdrawals on Apr 10,https://announcements.bybit.com/en-US/article/helium-network-migration-suspension-of-hnt-deposits-and-withdrawals-on-mar-20-blt7ef6e084c8f7ecde/,83
2023-03-13,Bybit Quests: Learn About the Ethereum Shanghai Upgrade and Stand to Win 25 USDT,https://announcements.bybit.com/en-US/article/bybit-quests-learn-about-the-ethereum-shanghai-upgrade-and-stand-to-win-25-usdt-blt10634893fd28fce4/,83
2023-03-11,Adjustment of Funding Rate Interval & Upper and Lower limit of Funding rate for USDCUSDT Perpetual Contract,https://announcements.bybit.com/en-US/article/adjustment-of-funding-rate-interval-upper-and-lower-limit-of-funding-rate-for-usdcusdt-perpetual-contract-blt5761d7aac6282f7b/,84
2023-03-11,Changes to USDC Collateral Value (UTA/UMA),https://announcements.bybit.com/en-US/article/changes-to-usdc-collateral-value-uta-uma--bltd44a7dcdf53427b7/,83
2023-03-10,P2P Trading on Bybit: Now Recruiting AZN Advertisers 🙌,https://announcements.bybit.com/en-US/article/p2p-trading-on-bybit-now-recruiting-azn-advertisers--blt36010c1ea33588cf/,84
2023-03-10,P2P Trading on Bybit: Now Supporting AZN 💵,https://announcements.bybit.com/en-US/article/p2p-trading-on-bybit-now-supporting-azn--blt0b68265348e87736/,84
2023-03-10,[VIP & INS Exclusive] Upgrade to Unifed Trading Account & Enjoy Zero Fees on Options!,https://announcements.bybit.com/en-US/article/-vip-ins-exclusive-upgrade-to-unifed-trading-account-enjoy-zero-fees-on-options--blt74e0c7ccf91fab45/,84
2023-03-10,"New Listing: VRA/USDT — Grab a Share of the 11,000,000 VRA Prize Pool!",https://announcements.bybit.com/en-US/article/new-listing-vra-usdt-grab-a-share-of-the-11-000-000-vra-prize-pool--blt5deb8c93440e0f45/,84
2023-03-09,"New Listings: GPT/USDT — Grab a Share of the 100,000 USDT Prize Pool!",https://announcements.bybit.com/en-US/article/new-listings-gpt-usdt-grab-a-share-of-the-100-000-usdt-prize-pool--blt3d1e2b287222b7e0/,84
2023-03-09,"P2P Campus Challenge: Learn and Earn from the 10,000 USDT Prize Pool!",https://announcements.bybit.com/en-US/article/p2p-campus-challenge-learn-and-earn-from-the-10-000-usdt-prize-pool--blt13a6db83e9078734/,84
2023-03-09,"Bybit x ApeX Pro: Join the MVP Traders League & Unlock the 100,000 USDC Prize Pool!",https://announcements.bybit.com/en-US/article/bybit-x-apex-pro-join-the-mvp-traders-league-unlock-the-100-000-usdc-prize-pool--blt2b46aba93057ce41/,84
2023-03-08,Changes to Max. Open Interest for Perpetual Contracts,https://announcements.bybit.com/en-US/article/changes-to-max-open-interest-for-perpetual-contracts-blt3b3ed9a3cfd250ba/,85
2023-03-08,"Trading Rodeo: Grab a Share of the 700,000 USDT Prize Pool!",https://announcements.bybit.com/en-US/article/trading-rodeo-grab-a-share-of-the-700-000-usdt-prize-pool--blt7a5ed1aed263cb6e/,85
2023-03-07,Spot Trading System Maintenance,https://announcements.bybit.com/en-US/article/spot-trading-system-maintenance-blt1ce883424d3706b5/,85
2023-03-06,[Selected Southeast Asia Only] Bybit x Lingose Flash USDT Airdrop,https://announcements.bybit.com/en-US/article/-selected-southeast-asia-only-bybit-x-lingose-flash-usdt-airdrop-blt27a8503e6f964f17/,86
2023-03-06,Bybit Savings: Up to 7% APY 💥,https://announcements.bybit.com/en-US/article/bybit-savings-up-to-7-apy--blt6549b7c919f98783/,86
2023-03-06,"Notice on Delisting of NXD, POSI, GAS, DRIV, DFL and FIU",https://announcements.bybit.com/en-US/article/notice-on-delisting-of-nxd-posi-gas-driv-dfl-and-fiu-bltbd742117e4c1b566/,86
2023-03-06,"Join the Spring Copy Trading Party and Share 98,000 USDT!",https://announcements.bybit.com/en-US/article/join-the-spring-copy-trading-party-and-share-98-000-usdt--blt607185ba1317549c/,85
2023-03-06,Introducing Bybit Card: Take Your Crypto on the Go,https://announcements.bybit.com/en-US/article/introducing-bybit-card-take-your-crypto-on-the-go-bltfa20750c9483ada4/,85
2023-03-06,Upcoming Updates to the Unified Trading Account/Unified Margin Account,https://announcements.bybit.com/en-US/article/upcoming-updates-to-the-unified-trading-account-unified-margin-account-bltec53bf1eacb6b6e0/,85
2023-03-06,"Join the NFT Raffle and Unlock Up to 200,000 USDT Prize Pool!",https://announcements.bybit.com/en-US/article/join-the-nft-raffle-and-unlock-up-to-200-000-usdt-prize-pool--blt6a555eb090e88c5d/,85
2023-03-06,Futures Grid Bot APR Competition: Weekly Winners,https://announcements.bybit.com/en-US/article/futures-grid-bot-apr-competition-weekly-winners-blt1b992a3f2c002ed9/,85
2023-03-06,Bybit Quests: Learn About Trading Bots and Stand to Win 25 USDT,https://announcements.bybit.com/en-US/article/bybit-quests-learn-about-trading-bots-and-stand-to-win-25-usdt-blt6dd5aaa2c9b1d09f/,86
2023-03-05,"King of Trader: Trade to Grab a Share of the 200,000 USDT Prize Pool!",https://announcements.bybit.com/en-US/article/king-of-trader-trade-to-grab-a-share-of-the-200-000-usdt-prize-pool--blt1e8948784f4ba452/,86
2023-03-04,Notice on Suspension of USD Payments via Bank Transfer,https://announcements.bybit.com/en-US/article/notice-on-suspension-of-usd-payment-with-bank-transfer-blt8fe1124f4dc5c6a1/,86
2023-03-03,Bybit to Support Stargate Finance (STG) Contract Swap (Expected on Mar 15),https://announcements.bybit.com/en-US/article/bybit-to-support-stargate-finance-stg-contract-swap-expected-on-mar-15--blt91e8ea8fcb625c0f/,86
2023-03-03,Become a Master Trader with Bybit's Optimized Application Process,https://announcements.bybit.com/en-US/article/become-a-master-trader-with-bybit-s-optimized-application-process-bltd0e856177942735b/,86
2023-03-03,Get Ready for the Ethereum Shanghai Upgrade: Your Essential Packing List,https://announcements.bybit.com/en-US/article/get-ready-for-the-ethereum-shanghai-upgrade-your-essential-packing-list-bltb99064168e530836/,87
2023-03-03,ByVotes Chapter 12: The Results Are In!,https://announcements.bybit.com/en-US/article/byvotes-chapter-12-the-results-are-in--blt0c3a01f11426c200/,87
2023-03-02,"New Listing: PIP/USDT — 375,000 PIP Up for Grabs!",https://announcements.bybit.com/en-US/article/new-listing-pip-usdt-375-000-pip-up-for-grabs--blt5f67fc27dfcf9225/,87
2023-03-01,"Listing of PRIME/USDT on Mar 1, 2023",https://announcements.bybit.com/en-US/article/listing-of-prime-usdt-on-mar-1-2023-blt23ea9636e78d87be/,87
2023-03-01,Discover Tools Tailored to Your Needs,https://announcements.bybit.com/en-US/article/discover-tools-tailored-to-your-needs-blt83beab6328f2737c/,87
2023-03-01,"Referral Royale: Earn Cashback From 200,000 USDT Prize Pool",https://announcements.bybit.com/en-US/article/referral-royale-earn-cashback-from-200-000-usdt-prize-pool-blt8c4ae988e0ba6b3b/,87
2023-03-01,Update on Max. Order Value for Spot Pairs,https://announcements.bybit.com/en-US/article/update-on-max-order-value-for-spot-pairs-blt1f5bc6b79af1f780/,87
2023-03-01,[Thailand Exclusive] Kickstart Bybit Journey with $80 Bonus,https://announcements.bybit.com/en-US/article/kickstart-bybit-journey-with-80-bonus-bltd45175c6f587e6da/,87
2023-02-28,Upgrades to Earn Accounts (Mar 2023),https://announcements.bybit.com/en-US/article/upgrades-to-earn-accounts-mar-2023--blt35196319ed10c05c/,88
2023-02-28,P2P Advertisers: Be the Best and Get Up to 250 USDT Each Week!,https://announcements.bybit.com/en-US/article/p2p-advertisers-be-the-best-and-get-up-to-250-usdt-each-week--blt6c407935802eadf4/,88
2023-02-27,"ByVotes Chapter 12: Vote for Your Favorite Project From Everscale, Poolz Finance and Verasity",https://announcements.bybit.com/en-US/article/byvotes-chapter-12-vote-for-your-favorite-project-from-everscale-poolz-finance-and-verasity-blt6ecc6610bfe8279e/,88
2023-02-27,New Listing: DPX/USDT — Grab a Share of the 330 DPX Prize Pool!,https://announcements.bybit.com/en-US/article/new-listing-dpx-usdt-grab-a-share-of-the-330-dpx-prize-pool--blt64746458ace26284/,88
2023-02-27,Bybit Savings: Up to 5.5% APY! 💥,https://announcements.bybit.com/en-US/article/bybit-savings-up-to-5-5-apy--blt321176da987635cd/,88
2023-02-27,"Ethereum Shanghai Upgrade: Learn and Earn From the 2,000 USDT Prize Pool",https://announcements.bybit.com/en-US/article/ethereum-shanghai-upgrade-learn-and-earn-from-the-2-000-usdt-prize-pool-blte125ed106ce8bad8/,88
2023-02-27,Upcoming Changes: Spot Account to Merge with Unified Trading Account,https://announcements.bybit.com/en-US/article/upcoming-changes-spot-account-to-merge-with-unified-trading-account-blt488965ae082a61c0/,89
2023-02-27,Bybit Quests: Learn How to Spring Clean Your Portfolio & Stand to Win 25 USDT,https://announcements.bybit.com/en-US/article/bybit-quests-learn-how-to-spring-clean-your-portfolio-stand-to-win-25-usdt-blt63e2adf26eb206a3/,89
2023-02-27,Adjustment of Upper and Lower limit of Funding rate for XEMUSDT Perpetual Contracts,https://announcements.bybit.com/en-US/article/adjustment-of-upper-and-lower-limit-of-funding-rate-for-xemusdt-perpetual-contracts-blt58371c8aed665ee5/,88
2023-02-27,Updates to Master Trader Labels,https://announcements.bybit.com/en-US/article/updates-to-master-trader-labels-blt61040c4df58795a2/,88
2023-02-24,Just Landed: 13 New Trading Pairs 🔥,https://announcements.bybit.com/en-US/article/just-landed-13-new-trading-pairs--blta1040c913cc065d9/,89
2023-02-24,Adjustment of Funding Rate Interval for STXUSDT Contract,https://announcements.bybit.com/en-US/article/adjustment-of-funding-rate-interval-for-stxusdt-contract-bltb4f89a791a48ce04/,89
2023-02-24,"Derivatives: Adjustment of Maximum Order Size (Feb 17, 2023 — Feb 23, 2023)",https://announcements.bybit.com/en-US/article/derivatives-adjustment-of-maximum-order-size-feb-17-2023-feb-23-2023--blt8734977624ddece2/,89
2023-02-23,Notice on Delisting of OKSE/USDC Spot Pair,https://announcements.bybit.com/en-US/article/notice-on-delisting-of-okse-usdc-spot-pair-blt83030bdc5fe4752b/,89
2023-02-23,Embark on a Crypto Adventure with Bybit Quests! 🌊,https://announcements.bybit.com/en-US/article/embark-on-a-crypto-adventure-with-bybit-quests--bltc7bcb85137215ab6/,90
2023-02-23,Bybit Quest #1: Learn About Stablecoins and Win Exclusive Oracle Red Bull Racing Merchandise!,https://announcements.bybit.com/en-US/article/bybit-quest-1-learn-about-stablecoins-and-win-exclusive-oracle-red-bull-racing-merchandise--blt6b80b0137c3f6454/,90
2023-02-23,P2P Trading: Trade BTC With All Supported Fiat Currencies,https://announcements.bybit.com/en-US/article/p2p-trading-trade-btc-with-all-supported-fiat-currencies-bltf7112fad8e85b61f/,89
2023-02-23,"Futures Grid Bots: 100,000 USDT Prize Pool Awaits!",https://announcements.bybit.com/en-US/article/futures-grid-bots-100-000-usdt-prize-pool-awaits--bltdc84171cb213709f/,89
2023-02-22,Changes to Tick Size for USDT Perpetual Contracts (2023-02-22),https://announcements.bybit.com/en-US/article/changes-to-tick-size-for-usdt-perpetual-contracts-2023-02-22--blt92a012f075df7bc5/,90
2023-02-22,Update to Master Trader Portfolio Page,https://announcements.bybit.com/en-US/article/update-to-master-trader-portfolio-page-blt2ff65d262d111779/,90
2023-02-22,Bybit App: Temporary Restriction of NFT Functions on iOS,https://announcements.bybit.com/en-US/article/bybit-app-temporary-restriction-of-nft-functions-on-ios-blta2f84c720ada28b4/,90
2023-02-21,Adjustment of Upper and Lower limit of Funding rate for BELUSDT Perpetual Contracts,https://announcements.bybit.com/en-US/article/adjustment-of-upper-and-lower-limit-of-funding-rate-for-belusdt-perpetual-contracts-blt303d55d341fa0a36/,90
2023-02-21,Join the Bybit Fight Club and Win Weekly USDT Bonuses!,https://announcements.bybit.com/en-US/article/join-the-bybit-fight-club-and-win-weekly-usdt-bonuses--bltd0e441e4f93e72a1/,91
2023-02-21,"Learn & Earn: Deposit USD & Share the 1,300 USDT Bonus Pool!",https://announcements.bybit.com/en-US/article/learn-earn-deposit-usd-share-the-1-300-usdt-bonus-pool--blt4747ae5acc34845b/,90
2023-02-21,"New Listing: HVH/USDT — Grab a Share of the 900,000 HVH Prize Pool!",https://announcements.bybit.com/en-US/article/new-listing-hvh-usdt-grab-a-share-of-the-900-000-hvh-prize-pool--bltdbc12f68ba6e8f3d/,90
2023-02-20,"[Affiliates] Master Trader Star Search: Invite and Share the 20,000 USDT Prize Pool!",https://announcements.bybit.com/en-US/article/-affiliates-master-trader-star-search-invite-and-share-the-20-000-usdt-prize-pool--bltbe3589aa82ef55a5/,91
2023-02-20,📱 Review the Bybit App and Win an iPhone 14 Pro & More!,https://announcements.bybit.com/en-US/article/-review-the-bybit-app-and-win-an-iphone-14-pro-more--blt202968671f8db8a5/,91
2023-02-20,Bybit Quest: Learn About Staking & Stand to Win 25 USDT,https://announcements.bybit.com/en-US/article/bybit-quest-learn-about-staking-stand-to-win-25-usdt-blt02246cae4f15c2a7/,91
2023-02-20,"Grab a Share of the 40,000 USDT and 4,000,000 GSTS Prize Pools!",https://announcements.bybit.com/en-US/article/grab-a-share-of-the-40-000-usdt-and-4-000-000-gsts-prize-pools--blt65f67858e300a31e/,91
2023-02-20,"Master Trader Talent Search: Invite and Share the 30,000 USDT Prize Pool!",https://announcements.bybit.com/en-US/article/master-trader-talent-search-invite-and-share-the-30-000-usdt-prize-pool--blt28245a02e14237e7/,91
2023-02-20,Adjustment of Upper and Lower limit of Funding rate for STXUSDT Perpetual Contracts,https://announcements.bybit.com/en-US/article/adjustment-of-upper-and-lower-limit-of-funding-rate-for-stxusdt-perpetual-contracts-bltfc47e3c9062a5cc9/,91
2023-02-20,P2P Carnival Day: 600 USDT Up for Grabs!,https://announcements.bybit.com/en-US/article/p2p-carnival-day-600-usdt-up-for-grabs--blt42f5af0290ae97ed/,91
2023-02-17,Upcoming Listing: GNS/USDT,https://announcements.bybit.com/en-US/article/upcoming-listing-gns-usdt-blt998422bcdb14dcc1/,92
2023-02-17,New Listing: GNS/USDT,https://announcements.bybit.com/en-US/article/new-listing-gns-usdt-bltde5b67905407153c/,92
2023-02-17,"February Derivatives Faceoff: Trade and Unlock a 150,000 USDC Prize Pool!",https://announcements.bybit.com/en-US/article/february-derivatives-faceoff-trade-and-unlock-a-150-000-usdc-prize-pool--bltec07bbd1cf5c781d/,92
2023-02-17,Adjustment of Collateral Value Ratio on Bybit,https://announcements.bybit.com/en-US/article/adjustment-of-collateral-value-ratio-on-bybit-blt73ac6fdddc0fc736/,92
2023-02-16,Referral Lucky Draw: Invite Friends and Win 20 USDT,https://announcements.bybit.com/en-US/article/referral-lucky-draw-invite-friends-and-win-20-usdt-bltf0546a3dc671726e/,92
2023-02-16,USD: Now Available on Fiat Deposit!,https://announcements.bybit.com/en-US/article/usd-now-available-on-fiat-deposit--blt349bd65175995977/,92
2023-02-16,Bybit Conducts Regular Proof of Reserves Audits,https://announcements.bybit.com/en-US/article/bybit-conducts-regular-proof-of-reserves-audits-bltb54e53a391ffd67f/,92
2023-02-16,Show Your Trading Talent as a Master Trader,https://announcements.bybit.com/en-US/article/show-your-trading-talent-as-a-master-trader-blt597eb4dbbd62c8bc/,93
2023-02-16,Futures Grid Bots: New Copy Function and Higher Leverage Limits,https://announcements.bybit.com/en-US/article/futures-grid-bots-new-copy-function-and-higher-leverage-limits-blt3700785841d7f8eb/,92
2023-02-15,[Selected Southeast Asia Exclusive] Memecoin Party 💰,https://announcements.bybit.com/en-US/article/-selected-southeast-asia-exclusive-memecoin-party--bltc602bbbc2064e061/,93
2023-02-15,"Bybit Community Games: Grab a Share of the 54,000 USDT Prize Pool & Win Rewards!",https://announcements.bybit.com/en-US/article/bybit-community-games-grab-a-share-of-the-54-000-usdt-bonus-pool-win-rewards--blt33ac69f3b9c1038c/,93
2023-02-15,Updates to the Asset Exchange Feature for Easier Access,https://announcements.bybit.com/en-US/article/updates-to-the-asset-exchange-feature-for-easier-access-blt00fcd7faa0c11e7e/,93
2023-02-14,"Bybit x ACS: Share a 200,000,000 ACS Prize Pool",https://announcements.bybit.com/en-US/article/bybit-x-acs-share-a-200-000-000-acs-prize-pool-bltd85694adfd5673e6/,93
2023-02-14,Will You Be My P2P Valentine? Declare Your Love & Earn 20 USDT Bonus!,https://announcements.bybit.com/en-US/article/will-you-be-my-p2p-valentine-declare-your-love-earn-20-usdt-bonus--bltacf1f6894e03354f/,93
2023-02-14,Delisting of BNXUSDT Perpetual Contract,https://announcements.bybit.com/en-US/article/delisting-of-bnxusdt-perpetual-contract-blt8efa3ed073235940/,93
2023-02-13,Changes to Max. Order Size for USDT Perpetual Contracts (2023-02-13),https://announcements.bybit.com/en-US/article/changes-to-max-order-size-for-usdt-perpetual-contracts-2023-02-13--blteb0d8499ca1206f4/,94
2023-02-13,"[Africa Exclusive] VIP Special: Claim $10,000 Worth of Free Positions on 5 Derivatives Pairs",https://announcements.bybit.com/en-US/article/-africa-exclusive-vip-special-claim-10-000-worth-of-free-positions-on-5-derivatives-pairs-blte2ad8d21bca83030/,94
2023-02-13,"USDC Party: 0 Fees on Spot, 30% APY and Up to 2,000 USDC in Bonuses Each!",https://announcements.bybit.com/en-US/article/usdc-party-0-fees-on-spot-30-apy-and-up-to-2-000-usdc-in-bonuses-each--bltccd861ada563f0d9/,93
2023-02-13,"Dual Asset 2.0: LDO, GMX and OP Now Supported💥",https://announcements.bybit.com/en-US/article/dual-asset-2-0-ldo-gmx-and-op-now-supported--blt0a641707ef3efc3a/,94
2023-02-10,Bybit to Support Terra Classic (LUNC) Network Upgrade (Expected on Feb 14),https://announcements.bybit.com/en-US/article/bybit-to-support-terra-classic-lunc-network-upgrade-expected-on-feb-14--blt2ef71c52902edaf9/,94
2023-02-10,Bybit to Support Cardano (ADA) Network Upgrade (Expected on Feb 14),https://announcements.bybit.com/en-US/article/bybit-to-support-cardano-ada-network-upgrade-expected-on-feb-14--blt5c09480688df44ef/,95
2023-02-10,Notice on Delisting of ESNC,https://announcements.bybit.com/en-US/article/notice-on-delisting-of-esnc-blt9c0a438b02f2aa3e/,94
2023-02-10,Bybit to Support Cosmos' Rho Upgrade (Expected on Feb 16),https://announcements.bybit.com/en-US/article/bybit-to-support-cosmos-rho-upgrade-expected-on-feb-16--bltde502490d2a4a04a/,94
2023-02-10,Adjustment of Withdrawal Fees on the TRON (TRX) Network,https://announcements.bybit.com/en-US/article/adjustment-of-withdrawal-fees-on-the-tron-trx-network-blt5ada55da5adafbfb/,94
2023-02-10,ByVotes Chapter 11: Congrats! You Voted for the Winning Project!,https://announcements.bybit.com/en-US/article/byvotes-chapter-11-congrats-you-voted-for-the-winning-project--blt47869958e7b9cf0e/,94
2023-02-09,Upcoming Listing: HVH/USDT,https://announcements.bybit.com/en-US/article/upcoming-listing-hvh-usdt-blt3bde3db111637882/,95
2023-02-09,New Listing:  AGIX/USDT,https://announcements.bybit.com/en-US/article/new-listing-agix-usdt-blt0bc1fe3ec735b7ff/,95
2023-02-09,Bybit's Token Delisting Process,https://announcements.bybit.com/en-US/article/bybit-s-token-delisting-process-blt9f6b561829f0112e/,95
2023-02-09,Copy Trading: Share Your Accomplishments & Enjoy Optimized Trade Settings,https://announcements.bybit.com/en-US/article/copy-trading-share-your-accomplishments-enjoy-optimized-trade-settings-blt5d58940788d85964/,95
2023-02-08,"Share a 50,000 USDT Bonus Pool With Bybit x CORE",https://announcements.bybit.com/en-US/article/share-a-50-000-usdt-bonus-pool-with-bybit-x-core-bltcf78cc802a571774/,95
2023-02-08,Bybit to Support Harmony (ONE) Hard Fork,https://announcements.bybit.com/en-US/article/bybit-to-support-harmony-one-hard-fork-blt19ad03984858795e/,95
2023-02-08,Valentine's Referral: Share the Love to Earn 50 USDT and 30% Commissions!,https://announcements.bybit.com/en-US/article/valentine-s-referral-share-the-love-to-earn-50-usdt-and-30-commissions--blte402bdbabba6b889/,95
2023-02-07,"💕 Valentine's With DCA: Earn Up to 19,690% APR",https://announcements.bybit.com/en-US/article/-valentine-s-with-dca-earn-up-to-19-690-apr-bltd673f06c2385bfdd/,96
2023-02-07,"New Listing: RDNT/USDT — Grab a Share of the 700,000 RDNT Prize Pool!",https://announcements.bybit.com/en-US/article/new-listing-rdnt-usdt-grab-a-share-of-the-700-000-rdnt-prize-pool--blt58b64c1124513ff6/,96
2023-02-07,Changes to Tick Size for USDT & USDC Perpetual Contracts (2023-02-08),https://announcements.bybit.com/en-US/article/changes-to-tick-size-for-usdt-usdc-perpetual-contracts-2023-02-08--blt80c14139bdd327bc/,96
